Hearing_group,Species,Species_group,Study,Area,Source,Sound_source,Sound_source_position,Sound_source_depth,Frequency_reported,Duration,RL,RL_unit,RL_measured_or_estimated,Source_range,Number_individuals,Sex,Age_yr,PriorBehavior,Behavioural_response,Highest_severity_scale ,Behavior2,Displacement_avoidance ,Acoustic_change_type
Low-frequency,Bowhead whale,Mysticetes,Ljungblad et al. 1988,Beaufort Sea,Seismic-Explosion,Seismic,Moving (approaching),,,"airgun fired once every 4 sec, 5.5 h experimental period",132,rms,Measured,9.6 km,,,,,None,0,Low,Not-avoidance,Not measured/reported
Low-frequency,Bowhead whale,Mysticetes,Ljungblad et al. 1988,Beaufort Sea,Seismic-Explosion,Seismic,Moving (approaching),,,"airgun fired once every 4 sec, 5.5 h experimental period",142,rms,Measured,3.5 km,,,,,"Huddling, followed by avoidance responses",6,High,Avoidance,Not measured/reported
Low-frequency,Bowhead whale,Mysticetes,Ljungblad et al. 1988,Beaufort Sea,Seismic-Explosion,Seismic,Moving (approaching),,,"airgun fired once every 4 sec, 5.5 h experimental period",152,rms,Measured,1.3 km,,,,,All whales exhibiting avoidance responses,6,High,Avoidance,Not measured/reported
Low-frequency,Bowhead whale,Mysticetes,Ljungblad et al. 1988,Beaufort Sea,Seismic-Explosion,Seismic,Moving (approaching),,,"activated every 12 - 14 sec, 5 h experimental period",,,,8 km,,,,,None,0,Low,Not-avoidance,Not measured/reported
Low-frequency,Bowhead whale,Mysticetes,Ljungblad et al. 1988,Beaufort Sea,Seismic-Explosion,Seismic,Moving (approaching),,,"activated every 12 - 14 sec, 5 h experimental period",165,rms,Measured,7.2 km,,,,,"Satrtle responses, followed by avoidance responses",6,High,Avoidance,Not measured/reported
Low-frequency,Bowhead whale,Mysticetes,Ljungblad et al. 1988,Beaufort Sea,Seismic-Explosion,Seismic,Moving (approaching),,,"activated every 12 - 14 sec, 5 h experimental period",170,rms,Measured,3.5 km,,,,,All whales exhibiting avoidance responses,6,High,Avoidance,Not measured/reported
Low-frequency,Bowhead whale,Mysticetes,Ljungblad et al. 1988,Beaufort Sea,Seismic-Explosion,Seismic,Moving (approaching),,,"every 12 - 14 sec, 6 h experimental period",148,rms,Measured,15.5 km,,,,,None,0,Low,Not-avoidance,Not measured/reported
Low-frequency,Bowhead whale,Mysticetes,Ljungblad et al. 1988,Beaufort Sea,Seismic-Explosion,Seismic,Moving (approaching),,,"every 12 - 14 sec, 6 h experimental period",,,,> 12 km,,,,,None,0,Low,Not-avoidance,Not measured/reported
Low-frequency,Bowhead whale,Mysticetes,Ljungblad et al. 1988,Beaufort Sea,Seismic-Explosion,Seismic,Moving (approaching),,,"every 12 - 14 sec, 6 h experimental period",155,rms,Measured,11.6 km,,,,,None,0,Low,Not-avoidance,Not measured/reported
Low-frequency,Bowhead whale,Mysticetes,Ljungblad et al. 1988,Beaufort Sea,Seismic-Explosion,Seismic,Moving (approaching),,,"every 12 - 14 sec, 6 h experimental period",178,rms,Measured,3.5 km,,,,,Whales exhibiting avoidance responses,6,High,Avoidance,Not measured/reported
Low-frequency,Bowhead whale,Mysticetes,Ljungblad et al. 1988,Beaufort Sea,Seismic-Explosion,Seismic,Moving (approaching),,,12 - 24 sec,,,,12 km,,,,,None,0,Low,Not-avoidance,Not measured/reported
Low-frequency,Bowhead whale,Mysticetes,Ljungblad et al. 1988,Beaufort Sea,Seismic-Explosion,Seismic,Moving (approaching),,,12 - 24 sec,155,rms,Measured,10.4 km,,,,,None,0,Low,Not-avoidance,Not measured/reported
Low-frequency,Bowhead whale,Mysticetes,Ljungblad et al. 1988,Beaufort Sea,Seismic-Explosion,Seismic,Moving (approaching),,,12 - 24 sec,157,rms,Measured,8.2 km,,,,,Possible subtle behavior chnages,4,Moderate,Not-avoidance,Not measured/reported
Low-frequency,Bowhead whale,Mysticetes,Ljungblad et al. 1988,Beaufort Sea,Seismic-Explosion,Seismic,Moving (approaching),,,12 - 24 sec,158,rms,Measured,7.6 km,,,,,5 whales begin vessel avoidance responses,6,High,Avoidance,Not measured/reported
Low-frequency,Bowhead whale,Mysticetes,Ljungblad et al. 1988,Beaufort Sea,Seismic-Explosion,Seismic,Moving (approaching),,,12 - 24 sec,158,rms,Measured,7 km,,,,,2 additional whales begin vessel avoidance responses,6,High,Avoidance,Not measured/reported
Low-frequency,Bowhead whale,Mysticetes,Ljungblad et al. 1988,Beaufort Sea,Seismic-Explosion,Seismic,Moving (approaching),,,12 - 24 sec,159,rms,Measured,6.6 km,,,,,7 additional whales begin vessel avoidance responses ,6,High,Avoidance,Not measured/reported
Low-frequency,Bowhead whale,Mysticetes,Ljungblad et al. 1988,Beaufort Sea,Seismic-Explosion,Seismic,Moving (approaching),,,12 - 24 sec,165,rms,Measured,2.9 km,,,,,All whales exhibiting avoidance responses,6,High,Avoidance,Not measured/reported
Low-frequency,Bowhead whale,Mysticetes,Ljungblad et al. 1988,Beaufort Sea,Seismic-Explosion,Seismic,Moving (approaching),,,12 - 24 sec,169,rms,Measured,1.8 km,,,,,Avoidance,6,High,Avoidance,Not measured/reported
Low-frequency,Humpback whale,Mysticetes,Todd et al. 1996,"Newfoundland, Canada",Seismic-Explosion,Explosion,Stationary,,principal energies under 1kHz,,153,peak or peak-to-peak,Measured,1.8 km,,,,,"Little behavioural reaction to the detonations in terms of decreased residency, overall movements, or general behaviour. However, it appears that the increased entrapment rate may have been influenced by the long term effects of exposure to deleterious levels of sound. ",2,Low,Not-avoidance,Not measured/reported
Low-frequency,Humpback whale,Mysticetes,"McCauley et al. 1998, 2000",Australia,Seismic-Explosion,Seismic,Moving,32 m,,,164,rms,Measured,3 km,,,,Traveling,This observation suggests localised avoidance of the operating airgun vessel during periods with the air guns on and agrees with published findings.,6,High,Avoidance,Not measured/reported
Low-frequency,Humpback whale,Mysticetes,"McCauley et al. 1998, 2000",Australia,Seismic-Explosion,Seismic,Moving,32 m,,,143,rms,Measured,1.22 - 4.4 km,,Females and calfs,,Resting,"The 16 approach trials carried out in Exmouth Gulf
revealed that humpback pods which contained females
consistently avoided an approaching single operating air
gun (Bolt 600B, 20 cui chamber) at a mean range of 1.3
km. Avoidance manoeuvres were evident before standoff
at ranges from 1.22–4.4 km. In one instance a startle
response was observed. The mean air gun level for
avoidance was 140 dB re 1 ?Pa rms, the mean standoff
range at 143 dB re 1 ?Pa rms and the startle response
observed at 112 dB re 1 ?Pa rms. These levels are
considerably less than those observed from the operating
seismic vessel observations made outside Exmouth Gulf
and from those published for gray and bowhead whales.
More recent work on migrating bowhead whales has
shown air gun levels for avoidance less than those
observed for the resting humpback whales (W.J.
Richardson, LGL. Ltd. Canada, pers. comm.). For the
observations made of humpbacks here, it is believed the
differences in behavioural state of the animals at the
times of the respective exposures primarily accounted
for the difference in response levels. Pods containing
females and inside Exmouth Gulf were invariably resting
or attempting to rest. Resting was a particularly important
behavioural state for cow-calf pods. It is believed that
whales engaged in such behaviours were more sensitive
to the approaching air gun than animals involved in the
purposeful migratory swimming behaviour seen as the
animals passed through the region of the seismic survey
to the north east of North West Cape.",6,High,Avoidance,Not measured/reported
Low-frequency,Humpback whale,Mysticetes,"McCauley et al. 1998, 2000",Australia,Seismic-Explosion,Seismic,Moving,32 m,,,179,rms,Measured,100 - 400 m,,"Single, large, mature
humpbacks (males)",,Traveling,"Although pods containing females kept the air gun at some standoff range during the Exmouth Gulf trials, in nine of the 16 trials mostly single, large, mature humpbacks approached the operating air gun to 100–400 m, investigated it, then swam off. These approaches were deliberate, direct and often at speed with one incoming whale clocked at 8 kn. ",1,Low,Not-avoidance,Not measured/reported
Low-frequency,Bowhead whale,Mysticetes,Reeves et al. 1984,Beaufort Sea,Seismic-Explosion,Seismic,Moving,4 - 8 m,most energy at 5 - 500 Hz, 8 to 15 seconds,,,,,,,,Traveling,"One possible behavioural response to seismic shooting was seen. On 14 September about 18 Bowheads were noted within a radius of 2—3 km, initially singly or in scattered groups of up to seven. During the shooting the whales gathered gradually into a single close concentration of 12-14 individuals (Figure 3), with four to six others within 1 km. Those in the group surfaced and dived almost synchronously, remaining submerged on average for 10-12 minutes and surfacing for 4—5 minutes; because they were so tightly bunched we had difficulty determining precise times for individuals. At the surface they huddled closely, often touching, with snouts tending to converge. They emitted sounds intermittently. Due to refuelling requirements we had to leave after 1 hr 40 min of observation. On this occasion huddling appeared as a possible response to seismic shooting, though we once saw it with fewer animals when there was no shooting. we note that 'adults' appear to spend significantly longer at the surface when in the presence of seismic sounds. This indication, though contrary to that of Fraker and others (1982), is reinforced particularly by our observations of 24 September, when we had opportunity to watch the same group of whales before and after seismic shooting began.",5,Moderate,Not-avoidance,Not measured/reported
Low-frequency,Bowhead whale,Mysticetes,Koski et al. (do not cite without permission),Beaufort Sea,Seismic-Explosion,Seismic,Moving,,,,130,rms,Measured,,,,,Traveling,"During the travelling period, sighting rates in the sub-area that included the seismic operation declined as seismic exposure increased suggesting localized avoidance of seismic operations",6,High,Avoidance,Not measured/reported
Low-frequency,Bowhead whale,Mysticetes,Koski et al. (do not cite without permission),Beaufort Sea,Seismic-Explosion,Seismic,Moving,,,,180,rms,Measured,,,,,Foraging,"Based on aerial sightings and observations from vessels, feeding bowheads appeared to tolerate seismic sounds until levels approached ~160dB but some feeding whales appear to have tolerated higher levels. One group of three whales tolerated received levels of seismic sounds ~180dB re 1 ?Pa (rms) and eight groups (12 individuals) tolerated levels >170dB.",0,Low,Not-avoidance,Not measured/reported
Low-frequency,Bowhead whale,Mysticetes,Blackwell et al. 2013,Beaufort Sea,Seismic-Explosion,Seismic,Moving,,10–450 Hz,"542,200 airgun pulses that occurred during 7,089 15 min intervals",129,rms,Estimated,41 - 45 km,,,,Traveling,"At the onset of airgun use, CLRs dropped significantly at sites near the airguns. This drop could result from a cessation of calling, deflection of whales around seismic activities, or both combined, but call locations alone were insufficient to differentiate between these possibilities. In these whales, CLRs dropped from an average of 10.2 calls/h before the onset of seismic operations to 1.5 call/h during and after airgun use. As analyzed in this study, the acoustic data alone cannot distinguish between a deflection and a cessation (or reduced rate) of calling. However, the aerial surveys conducted during the 2007 seismic operations described in this paper suggest only a modest offshore deflection related to seismic activities (chapter 7 in Ireland et al. 2009). During those observations, several groups of feeding whales were sighted a few km from the Gilavar’s airgun array.",4,Moderate,Not-avoidance,Vocalization Rate Decrease
Low-frequency,Bowhead whale,Mysticetes,Blackwell et al. 2013,Beaufort Sea,Seismic-Explosion,Seismic,Moving,,10–450 Hz,"542,200 airgun pulses that occurred during 7,089 15 min intervals",108,rms,Estimated,> 104 km,,,,Traveling,"CLRs remained unchanged at sites distant from the airguns, where median received levels were 99–108 dB re 1 lPa. For whales that were “far” from seismic
operations (median distance of 104–130 km) and experiencing median RLs of less than ~108 dB re 1 lPa, CLRs were not related to airgun use: CLRs were 5.7 calls/h
before airgun use and 6.4 calls/h during and after airgun use.",0,Low,Not-avoidance,No change
Low-frequency,Blue whale,Mysticetes,McDonald et al. 1995,"San Juan the Fuca Ridge, US",Seismic-Explosion,Seismic,Moving,,10-60 Hz,,143,peak or peak-to-peak,Estimated,10 km ,at least one ,,,Traveling,"The whale approached the ship while calling, but stopped calling about 10 km from the sound source, when RLs at the whale were about 143 dB re 1 uPa (peak-to-peak, 10–60 Hz band).",4,Moderate,Not-avoidance,Vocalization cessation
Low-frequency,Blue whale,Mysticetes,Di lorio and Clark 2010 but see Pinet et al. 2010,"St. Lawrence estuary, Canada",Seismic-Explosion,Seismic,Moving,,30 - 500 Hz,11 days,131,peak or peak-to-peak,Estimated,, 17 (plus five unidentified),,,Foraging,"Blue whales called consistently more on seismic exploration days than on non-exploration days as well as during periods within a seismic survey day when the sparker was operating. This increase was observed for the discrete, audible calls that are emitted during social encounters and feeding. ",4,Moderate,Not-avoidance,Vocalization Rate Increase
Low-frequency,Humpback whale,Mysticetes,Cerchio et al. 2014,Northern Angola,Seismic-Explosion,Seismic,Moving,,5 - 300 Hz & 30 to 450 Hz for sparker sources,449 hour periods during 50 days,156,peak or peak-to-peak,Measured,,,Male,,Socializing ,"The number of singers significantly decreased with increasing received level of seismic survey pulses; this explanatory variable was included among the top ranked models for one MARU in the full dataset and both MARUs in the reduced dataset. This suggests that the breeding display of humpback whales is disrupted by seismic survey activity, and thus merits further attention and study, and potentially conservation action in the case of sensitive breeding populations.",4,Moderate,Not-avoidance,Vocalization cessation
Low-frequency,Humpback whale,Mysticetes,Weir 2008,Angola,Seismic-Explosion,Seismic,Moving,4 - 8 m,10 - 200,Shooting at intervals of 25 meters for aprox 1300 h,,,,,,,,,"Relative abundance was slightly higher during full-array (0.046 animals/h) than guns-off (0.029 h) seismic. In distance bands beyond 3 km from the source, the full-array encounter rates were over twice those of guns off.",4,Moderate,Not-avoidance,Not measured/reported
Mid-frequency,Sperm whale,Sperm whale,Weir 2008,Angola,Seismic-Explosion,Seismic,Moving,4 - 8 m,10 - 200,Shooting at intervals of 25 meters for aprox 1300 h,,,,,,"Nursery groups of calves, juveniles, and adult females",,,"Sperm whales had similar relative abundance during full-array (0.31 animals/h) and guns-off (0.23 h) seismic. the airgun array during guns off (Figure 3b). Encounter rate was either similar to or higher during full array than guns off in most other distance bands, however, and was markedly higher at 0.5 to 0.9 km and at 5 to 6 km (Figure 3b).  The behaviour of sperm whales rarely changed during encounters, with animals frequently engaged in socialising bouts and feeding dives without obvious reaction as the active source passed.",4,Moderate,Not-avoidance,Not measured/reported
Mid-frequency,Atlantic spotted dolphin,Dolphin,Weir 2008,Angola,Seismic-Explosion,Seismic,Moving,4 - 8 m,10 - 200,Shooting at intervals of 25 meters for aprox 1300 h,,,,,,,,,"The Atlantic spotted dolphin encounter rate  was lowest during full-array operations and higher during guns-off and partial-array (0.009/h) seismic. The relative abundance of Atlantic spotted dolphins was double during guns-off than during full-array  seismic. In contrast, Atlantic spotted dolphin encounters during fullarray seismic involved either neutral behaviour or, more commonly, a negative response during which animals visibly detoured around the ship’s track and moved away (usually at high speed with apparent flight reaction).",6,High,Avoidance,Not measured/reported
Low-frequency,Fin whale,Mysticetes,Nieukirk et al. 2012 (which includes info from Nieukirk et al. 2004),Mid-Atlantic Ridge,Seismic-Explosion,Seismic,Moving,,2 - 188 Hz,"Airguns are fired every 10–60 s for days or weeks at a time, with occasional interruptions for such actions as turning the ship that tows the airgun array.",,,,4000 km,North Atlantic fin whale population is thought to exceed 50 000 animals,,,,"Airgun patterns varied from year to year. Thus, in some years (e.g., 2005) there was a great deal of overlap of peak fin whale calling activity and high airgun levels, while in others (e.g., 2001) we recorded lower levels of airgun activity during times when high levels of fin whale 20 Hz pulses were recorded",,,Not measured/reported,Vocalization frequency shift
Low-frequency,Bowhead whale,Mysticetes,Robertson et al. 2013 (chapter 2 of Robertson 2014),Beaufort Sea,Seismic-Explosion,Seismic,Moving ,,,,123,peak or peak-to-peak,Measured,,,,,Traveling,"Seismic activities may not have displaced bowhead whales as previously thought, but altered their dive behaviours instead and made them less visible for counting. As a consequence, previous estimates of numbers of whales exposed to moderate sounds related to seismic operations appear to have been underestimated. ",5,Moderate,Not-avoidance,Not measured/reported
Low-frequency,Gray whale,Mysticetes,"Johnson et al. 2007 (cited as Johnson 2002 in Gordon et al. 2004), Gailey et al. 2007, Yazvenko et al. 2007, Rutenko et al. 2007  ","Sakhalin Island, Russia",Seismic-Explosion,Seismic,Moving,,,,163,rms,Measured,,,,,Foraging,"Gray whales increased their speed, changed directions less, moved further from shore, and stayed under water longer between respirations when estimated received sound energy from the seismic survey increased. Some whales moved away from the survey area some whale did not and the ones that stayed in the area continue feeding. ",6,High,Avoidance,Not measured/reported
Low-frequency,Bowhead whale,Mysticetes,Greene et al. 1999,Beaufort Sea,Seismic-Explosion,Seismic,Moving,,,,,,,,,,,Traveling,"At least in 1996, patterns of call detection rates were consistent with aerial survey evidence that most bowheads were displaced from the area near the operating airguns. However, there was no significant tendency for  call detection rates to change consistently at times when airgun operations started or stopped.",6,High,Avoidance,"Vocalization rate decreased, no change "
Various,Various,Various,"Parente 2004, Parente et al. 2004, Parente and Araujo 2005, 2007",Brazil,Seismic-Explosion,Seismic,Moving,,,92 seismic surveys,,,,,,,,,The results suggest a decrease in the diversity of species in relation to the seismic surveys intensification during the years 2000 and 2001.,6,High,Avoidance,Not measured/reported
Mid-frequency,Sperm whale,Sperm whale,Mate et al. 1994,"Gulf of Mexico, US",Seismic-Explosion,Seismic,Moving,,,,,,,,,,,,Sperm whales were found routinely in the area before seismic operations beagn - abundance changed significantly during the following days during the seismic activities. During the first 2 days of the seismic activity whales were only seen around the periphery of the seismic area. ,6,High,Avoidance,Not measured/reported
various,Various,Various,Potter et al. 2007,Northwest Atlantic,Seismic-Explosion,Seismic,Moving,,most of the energy is concentrated around 50 Hz,,,,,,,,,,"Reactions: to stay outside a close approach circle, to be observed in larger groups, and to reduce vocalizations but not to move out of detection range. Marine mammals appeared to have avoided very close ranges ( 100 m) from the seismic array during seismic acquisition, but the overall number of marine mammals in the observable radius (1–2 km) did not change significantly when the seismic source was “on” compared to “off.” Marine mammals were observed in larger groups and appeared to have become less vocal when the seismic source was active.",4,Moderate,Not-avoidance,Vocalization Rate Decrease
various,Various,Various,Moulton and Miller 2005,"Gully Marine Protected Area, Canada",Seismic-Explosion,Seismic,Moving,,,,190,rms,Measured,700 - 10000 m ,,,,,"Monitoring from the seismic ship documented relatively small zones of avoidance around the operations area for baleen whales and toothed whales, and little evidence of avoidance by dolphins.",,,Not-avoidance,Not measured/reported
various,Various,Various,Simard et al. 2005,"Gully Marine Protected Area, Canada",Seismic-Explosion,Seismic,Moving,,,,135,rms,Measured,91 - 31 km,,,,,"Whale vocalizations were present at all stations. They include sperm whale clicks (1-15 kHz, 16/20 stations), northern bottlenose whale clicks (20-30 kHz, 13/20 stations), dolphin whistles (2-30 kHz, 17/20 stations), clicks from other odontocetes (possibly pilot whales, harbor porpoises, dolphins), other less frequent vocalizations and unidentified calls. Northern bottlenose whale clicking intensity matched the published local distribution of the species. These results indicate that the whales did not abandon the Gully area during the short observation period while the 3-D seismic exploration was carried out in the western part of the Marathon survey area, at ranges larger than 30 km.",,,Not-avoidance,Not measured/reported
various,Various,Various,Moulton and Holst 2010,Offshore Nova Scotian and Newfoundland,Seismic-Explosion,Seismic,Moving,,,,,,,,,,,,"During the monitored seismic programs, some cetacean groups and species exhibited localized avoidance as evidenced by reduced sighting rates, increased sighting distances, and movements away from the seismic vessel during periods when airgun(s) were operating. Of the three cetacean groups considered here, mysticetes were consistently seen farther away, at lower rates, and moving away from the seismic vessel during airgun operations. some delphinids appeared to exhibit localized avoidance of the source vessel. Based on initial sighting distances, delphinids were detected 200–300 m farther away from the source vessel during seismic vs. non-seismic periods.For large toothed whales (sperm and beaked whales) sighted during the current study in the northwest Atlantic, sighting rates and sighting distances were similar during periods when airguns were active vs. silent. Also, there was no tendency for large toothed whales to swim away from the seismic vessel during airgun operations.",6,High,Avoidance,Not measured/reported
Low-frequency,Fin and Humpback whale,Mysticetes,Clark and Gagnon 2006,,Seismic-Explosion,Seismic,Moving,,,,,,,,,,,,"Within an hour or less after the start of seismic operations, singing humpback and fin whales will stop singing, evidence suggest that many of these individuals stay in the area and that they resume singing when the seismic survey stops (Clark and Gagnon 2006). This change in the acoustic behaviour can last several days or weeks and cover areas on the order of 10-20,000 nmi2 . ",5,Moderate,Not-avoidance,Vocalization cessation
Low-frequency,Bowhead whale,Mysticetes,Richardson and Williams 2004 cited in Clark and Gagnon 2006,Beaufort Sea,Seismic-Explosion,Seismic,Moving,,,,,,,,,,,Traveling,In this context bowheads showed relatively strong avoidance out to 10 miles from the operational survey vessel.,6,High,Avoidance,Not measured/reported
Low-frequency,Humpback whale,Mysticetes,"Miller et al. 2000, Biassoni et al. 2000","Hawaii, US",LFAS,Low Frequency Sonar,Moving (approaching),60 - 180 m ,130 - 160 Hz (low component) and 260 - 320 Hz (high component),Ten (in one case four) 42-s LFA signals at 6-min intervals,150,rms,Estimated,< 4 km ,6,Male,,Socializing ,"The singing behaviour of male humpback whales was altered when they were exposed to LFA (low-frequency active) sonar. As the song of these whales is associated with reproduction, widespread alteration of their singing behaviour might affect demographic parameters, or it could represent a strategy to compensate for interference from the sonar.",5,Moderate,Not-avoidance,Vocalization duration increase
Mid-frequency,Various,Dolphin,Ranking and Evans 1998,"Gulf of Mexico, US",Seismic-Explosion,Seismic,Moving,,,,,,,,,,,,"The repetitive signals generated by seismic exploration may not have a negative impact on the distribution of odontocetes in the Gulf of Mexico. This study does not, however, present any information regarding smaller scale behavioral impacts. In addition to simultaneous cetacean observations with seismic exploration, acoustical monitoring indicated presence of cetacean vocalizations (including Stenella coeruleoalba, S. attenuata, S. Iongirostris, Physeter macrocephalus, and Steno bredanensis).",0,Low,Not-avoidance,Not measured/reported
Mid-frequency,Sperm whale,Sperm whale,"Jochens and Biggs 2003, Jochens et al. 2008","Gulf of Mexico, US",Seismic-Explosion,Seismic,Moving,,,,164,peak or peak-to-peak,Measured,1.4 - 12.6 km,8,,,Foraging,"Sperm whales increased rate of vocalizations during sound exposure. The direction of movement did not change for any of the eight exposed whales at either the onset of gradual ramp-up at ranges of 7.3-12.5 km or during full power exposures at ranges of 1.4-12.6 km. The CEE results, together with results from two other independent approaches, do not indicate any horizontal avoidance of sperm whales in the Gulf to seismic survey activities.These analyses indicated that the odds favor that, during full-array exposure, there was a decrease in foraging activity of approximately 20% rather than that there was no change in foraging activity.",4,Moderate,Not-avoidance,Vocalization Rate Increase
